{
  "contract_id": "bootstrap-profile",
  "version": "1.0.0",
  "status": "accepted",
  "owner_issue": "#30",
  "schema_path": "schemas/profile/bootstrap-profile.v1.schema.json",
  "normative_spec": "docs/architecture/profile-and-run-manifest.md",
  "conformance_suite": "profile",
  "compatibility": "initial"
}
