{
  "contract_id": "contract-manifest",
  "version": "1.0.0",
  "status": "accepted",
  "owner_issue": "#12",
  "schema_path": "schemas/registry/_meta.schema.json",
  "normative_spec": "docs/architecture/contract-registry.md",
  "conformance_suite": "contract-registry",
  "compatibility": "initial"
}
